Source,Primary ID,Title,Alternative title,Contributor,Abstract,Date,Genre,Topical subject,Name subject,Geographic subject,Title subject,Temporal subject,Language,Type of resource,Place of publication,Publisher,Form,Extent,Notes,Link,Image
LoC,ca00003105/,"Address of Frances E. Willard, president of the Woman's National Council of the United States (founded in 1888), at its first triennial meeting, Albaugh's Opera House, Washington, D.C., February 22-25, 1891",,"Willard, Frances E. (Frances Elizabeth) 1839-1898|Catt, Carrie Chapman 1859-1947|National Council of Women of the United States Meeting (1st : 1891 : Albaugh's Opera House, Washington, D.C.)|National American Woman Suffrage Association Collection (Library of Congress)|YA Pamphlet Collection (Library of Congress)","The National Council of Women of the United States was created in 1888 at the recommendation of Elizabeth Cady Stanton to further the goal of women's rights. It includes interesting information on the ideological differences between Willard and Stanton, as well as a discussion of ""Scientific Motherhood,"" and the worldwide WCTU.",[1891]|1891,,Women's rights|Women and religion,,United States,,,,text,"dcu|Washington, D.C","Rufus H. Darby, Printer",print,38 p. ; 24 cm.,general: Cover title.|additional physical form: Also available in digital form on the Library of Congress Web site.,https://www.loc.gov/item/ca00003105/,http://cdn.loc.gov/service/rbc/rbnawsa/n4556/001.gif
LoC,15016027/,"Socialism, feminism, and suffragism: the terrible triplets, connected by the same umbilical cord, and fed from the same nursing bottle",,"Hubbard, Benjamin Vestal 1854-|Catt, Carrie Chapman 1859-1947|National American Woman Suffrage Association Collection (Library of Congress)","This book equates feminism and woman suffrage with both socialism and atheism. According to the author, feminism and the enfranchisement of women will destroy the family. The book also suggests that pregnant women who vote run the risk of bearing ""physically imperfect or idiotic"" children.",[c1915]|1915,,Women and socialism|Women|Suffrage|Feminism,,,,,,text,ilu|Chicago,American Publishing Company,print,"3 p.l., 9-301 p. ; 20 cm.",statement of responsibility: by B.V. Hubbard.|additional physical form: Also available in digital form on the Library of Congress Web site.,https://www.loc.gov/item/15016027/,http://cdn.loc.gov/service/rbc/rbnawsa/n6027/001.gif
LoC,ca11002415/,The Ballot and the bullet,,"Catt, Carrie Chapman 1859-1947|Livermore, D. P. (Daniel Parker) 1818-1899|Chapman, Charles H.|Blackwell, Alice Stone 1857-1950|Davis, John 1826-1901|Catt, Carrie Chapman 1859-1947|National American Woman Suffrage Association|National American Woman Suffrage Association Collection (Library of Congress)",This is a collection of essays written to refute the argument that women should not be enfranchised because they are incapable of defending their right to vote by military service.,1897,,Women|Suffrage,,,,,,text,pau|Philadelphia,Published for The National American Woman Suffrage Association|Press of Alfred J. Ferris,print,73 p. ; 17 cm.,"statement of responsibility: compiled by Carrie Chapman Catt.|additional physical form: Also available in digital form on the Library of Congress Web site, and on microfilm (Microfilm 32064 JF).",https://www.loc.gov/item/ca11002415/,http://cdn.loc.gov/service/rbc/rbnawsa/n2415/001.gif
LoC,14005853/,"Speeches of George William Curtis, Henry Ward Beecher",Speeches of George William Curtis and Henry Ward Beecher,"Curtis, George William 1824-1892|Beecher, Henry Ward 1813-1887|Catt, Carrie Chapman 1859-1947|National American Woman Suffrage Association|National American Woman Suffrage Association Collection (Library of Congress)",,1898,biography,Women|Suffrage,,United States,,,,text,nyu|New York,The National-American Woman Suffrage Association,microfilm,"2 p.l., 90 p. ; 17 cm.","general: LC copy has annotations.|additional physical form: Also available in digital form on the Library of Congress Web site, and on microfilm (Microfilm 32064 JF).",https://www.loc.gov/item/14005853/,http://cdn.loc.gov/service/rbc/rbnawsa/n5853/001.gif
LoC,12029975/,Selected articles on woman suffrage,Woman suffrage,"Phelps, Edith M.|Stone, Lucy 1818-1893|National American Woman Suffrage Association Collection (Library of Congress)",This handbook contains a good debating outline and a bibliography to help students locate more materials on suffrage.,1912,bibliography,Women|Suffrage,,,,,,text,mnu|Minneapolis,The H.W. Wilson Company,print,"xxxvii, 162 p. ; 20 cm.",statement of responsibility: compiled by Edith M. Phelps.|bibliography: Bibliography: p. [xvii]-xxxvii.|additional physical form: Also available in digital form on the Library of Congress Web site.,https://www.loc.gov/item/12029975/,http://cdn.loc.gov/service/rbc/rbnawsa/n9975/001.gif
LoC,15015726/,How it feels to be the husband of a suffragette,,"Catt, Carrie Chapman 1859-1947|National American Woman Suffrage Association Collection (Library of Congress)",A humorous and highly entertaining account of suffrage written by a man married to a suffragist who is also a supporter of the woman suffrage movement.,[c1915]|1915,,Women|Suffrage,,,,,,text,nyu|New York,George H. Doran Company,print,63 p. : plates ; 20 cm.,statement of responsibility: by Him ; illustrations by May Wilson Preston.|additional physical form: Also available in digital form on the Library of Congress Web site.,https://www.loc.gov/item/15015726/,http://cdn.loc.gov/service/rbc/rbnawsa/n5726/001.gif
LoC,15013348/,Are women people?: a book of rhymes for suffrage times,New York tribune,"Miller, Alice Duer 1874-1942|Catt, Carrie Chapman 1859-1947|National American Woman Suffrage Association Collection (Library of Congress)","This is a collection of poetry concerning suffrage and women's rights, much of which was first published in the ""New York Times.""",[c1915]|1915,,Women|Suffrage,,,,,,text,nyu|New York,George H. Doran Company,print,"6 p.l., 11-94 p. ; 21 cm.",statement of responsibility: by Alice Duer Miller ...|general: Reprinted in part from the New York tribune.|additional physical form: Also available in digital form on the Library of Congress Web site.,https://www.loc.gov/item/15013348/,http://cdn.loc.gov/service/rbc/rbnawsa/n3348/001.gif
LoC,17007468/,"The Woman suffrage year book, 1917",,"Stapler, Martha G.|Catt, Carrie Chapman 1859-1947|National American Woman Suffrage Association Collection (Library of Congress)","This book was originally produced for use by suffrage workers. It contains a lot of statistical information valuable for conducting a national suffrage campaign, such as a listing of the states and foreign nations in which either full or partial woman suffrage exists; a list of senators and representatives who both favor and oppose woman suffrage; and an analysis of various laws affecting women and children.",1917,,Women|Suffrage|Women|Suffrage,,United States,,,,text,"nyu|New York, N.Y","National Woman Suffrage Publishing Company, Inc.",print,"204 p. : front. (map), fold. tab. ; 23 cm.",general: Editor: Martha G. Stapler; articles on special subjects contributed by Mary Sumner Boyd.|bibliography: Contains bibliography.|additional physical form: Also available in digital form on the Library of Congress Web site.,https://www.loc.gov/item/17007468/,http://cdn.loc.gov/service/rbc/rbnawsa/n7468/001.gif
LoC,88180024/,"The torch bearer: a look forward and back at the Woman's journal, the organ of the woman's movement",,"Ryan, Agnes E. 1878-1954|National American Woman Suffrage Association Collection (Library of Congress)","This pamphlet contains a history of the ""Woman's journal"" which was of the official publication of AWSA.",1916,,Women|Suffrage,,United States,"Woman's journal (Boston, Mass. : 1870)",,,text,"mau|Boston, Mass",Woman's Journal and Suffrage News,print,59 p. : ill. ; 23 cm.,statement of responsibility: by Agnes E. Ryan.|additional physical form: Also available in digital form on the Library of Congress Web site.,https://www.loc.gov/item/88180024/,http://cdn.loc.gov/service/rbc/rbnawsa/n0024/001.gif
LoC,ca10003542/,"Proceedings of the first anniversary of the American Equal Rights Association, held at the Church of the Puritans, New York, May 9 and 10, 1867",,"American Equal Rights Association|Parkhurst, Henry M. (Henry Martyn) 1825-1908|Catt, Carrie Chapman 1859-1947|National American Woman Suffrage Association Collection (Library of Congress)|Susan B. Anthony Collection (Library of Congress)","This report contains addresses by Elizabeth Cady Stanton, Samuel J. May, C.C. Burleigh, Frances D. Gage, Lucretia Mott, Parker Pillsbury, Ernestine Rose, Henry Ward Beecher, Sojourner Truth, and Charles Lenox Redmond. Some speeches discuss the relationship of woman suffrage to black manhood suffrage and the reasons for enfranchising women. It also includes the constitution of the Equal Rights Association and correspondence from various individuals.",1867,,Women's rights|Women|Suffrage|Women|Suffrage,,United States,,,,text,nyu|New York,"Robert J. Johnston, Printer",print,80 p. ; 23 cm.,statement of responsibility: phonographic report by H.M. Parkhurst.|additional physical form: Also available in digital form on the Library of Congress Web site.,https://www.loc.gov/item/ca10003542/,http://cdn.loc.gov/service/rbc/rbnawsa/n3542/001.gif
LoC,93838354/,"National Council of Women of the United States, report of its Tenth Annual Executive and its Third Triennial Sessions",Report of its Tenth Annual Executive and its Third Triennial Sessions,"National Council of Women of the United States Executive Session (10th : 1898 : Omaha, Neb.)|Sewall, May Wright 1844-1920|Catt, Carrie Chapman 1859-1947|National Council of Women of the United States Meeting (3rd : 1898 : Omaha, Neb.)|National American Woman Suffrage Association Collection (Library of Congress)","The National Council of Women of the United States was founded in 1888 by Susan B. Anthony at the suggestion of Elizabeth Cady Stanton. It was an organization composed of national organizations and affiliated associations all pledged to working for issues concerning women, among them, the right to vote. The organization met triennially at first, later biennially.",1899]|1899,conference publication,Women|Political activity|Women|Suffrage,,United States|United States,,,,text,inu|Indianapolis,Hollenbeck Press,print,309 p. ; 24 cm.,"statement of responsibility: edited by May Wright Sewall.|general: Includes index.|general: LC copy has bookplate: library, Carrie Chapman Catt|additional physical form: Also available in digital form on the Library of Congress Web site.|acquisition: Gift; National American Woman Suffrage Association; Nov. 1, 1938. DLC",https://www.loc.gov/item/93838354/,http://cdn.loc.gov/service/rbc/rbnawsa/n8354/001.gif
LoC,93838353/,"Program of the 5th Triennial Meeting of the National Council of Women of the United States: to be held at the Pythian Temple ... Washington, D.C., April 9 to 15, 1905",,"National Council of Women of the United States Meeting (5th : 1905 : Pythian Temple, Washington, D.C.)|Catt, Carrie Chapman 1859-1947|National American Woman Suffrage Association Collection (Library of Congress)","The National Council of Women of the United States was founded in 1888 by Susan B. Anthony at the suggestion of Elizabeth Cady Stanton. It was an organization composed of national organizations and affiliated associations all pledged to working for issues concerning women, among them, the right to vote. The organization met triennially at first, later biennially.",1905]|1905,conference publication,Women|Political activity|Women|Suffrage,,United States|United States,,,,text,"dcu|Washington, D.C",National Council of Women of the United States,print,[10] p. ; 24 cm.,"general: LC copy has bookplate: library, Carrie Chapman Catt.|additional physical form: Also available in digital form on the Library of Congress Web site.|acquisition: Gift; National American Woman Suffrage Association; Nov. 1, 1938. DLC",https://www.loc.gov/item/93838353/,http://cdn.loc.gov/service/rbc/rbnawsa/n8353/001.gif
LoC,93838355/,"Biennial of the proceedings of the National Council of Women, Washington, January 1916, and the Executive Meeting, New York, June 1916: with report of the International Congress of Women, San Francisco, Cal., November, 1915",Proceedings of the National Council of Women,"National Council of Women of the United States Meeting (1916 : Washington, D.C.)|Catt, Carrie Chapman 1859-1947|National American Woman Suffrage Association Collection (Library of Congress)","The National Council of Women of the United States was founded in 1888 by Susan B. Anthony at the suggestion of Elizabeth Cady Stanton. It was an organization composed of national organizations and affiliated associations all pledged to working for issues concerning women, among them, the right to vote. The organization met triennially at first, later biennially.",1916]|1916,conference publication,Women|Political activity|Women|Suffrage,,United States|United States,,,,text,"dcu|Washington, D.C",National Council of Women,print,"97 p. : ill., 4 ports. ; 23 cm.","general: Account of Executive Meeting not included in text.|general: LC copy has bookplate: library, Carrie Chapman Catt.|additional physical form: Also available in digital form on the Library of Congress Web site.|acquisition: Gift; National American Woman Suffrage Association; Nov. 1, 1938. DLC",https://www.loc.gov/item/93838355/,http://cdn.loc.gov/service/rbc/rbnawsa/n8355/001.gif
LoC,93838356/,"Biennial report of the National Council of Women of the United States: report of its Biennial Meeting, held at Washington, D.C., December 8, 9, 10, 11, and 12, 1917",,"National Council of Women of the United States Meeting (1917 : Washington, D.C.)|Bower, Emma E.|Catt, Carrie Chapman 1859-1947|National American Woman Suffrage Association Collection (Library of Congress)","The National Council of Women of the United States was founded in 1888 by Susan B. Anthony at the suggestion of Elizabeth Cady Stanton. It was an organization composed of national organizations and affiliated associations all pledged to working for issues concerning women, among them, the right to vote. The organization met triennially at first, later biennially.",[1917]|1917,conference publication,Women|Political activity|Women|Suffrage,,United States|United States,,,,text,"miu|Port Huron, Mich",Emma E. Bower,print,"78, [2] p., [4] leaves of plates : 4 ports. ; 24 cm.","statement of responsibility: edited and published by Emma E. Bower, M.D., treasurer.|general: Includes index.|general: LC copy has bookplate: library, Carrie Chapman Catt.|additional physical form: Also available in digital form on the Library of Congress Web site.|acquisition: Gift; National American Woman Suffrage Association; Nov. 1, 1938. DLC",https://www.loc.gov/item/93838356/,http://cdn.loc.gov/service/rbc/rbnawsa/n8356/001.gif
LoC,93838286/,"The proceedings of the Woman's Rights Convention, held at Worcester, October 23d & 24th, 1850",,"Woman's Rights Convention (1850 : Worcester, Mass.)|Stone, Lucy 1818-1893|National American Woman Suffrage Association Collection (Library of Congress)|Susan B. Anthony Collection (Library of Congress)","This pamphlet includes addresses by Paulina Wright Davis, Abby Price, and Harriet K. Hunt.",1851,conference publication,"Women's rights|Women|Legal status, laws, etc",,United States|United States,,,,text,mau|Boston,Published by Prentiss & Sawyer,print,84 p. ; 21 cm.,"general: LC copy formerly owned by Lucy Stone.|general: Includes tipped-in typed table of contents.|additional physical form: Also available in digital form on the Library of Congress Web site.|acquisition: Gift; National American Woman Suffrage Association; Nov. 1, 1938. DLC",https://www.loc.gov/item/93838286/,http://cdn.loc.gov/service/rbc/rbnawsa/n8286/001.gif
LoC,93838294/,The women's vote in Kansas,,"Adams, F. G. (Franklin George) 1824-1899|Stone, Lucy 1818-1893|National American Woman Suffrage Association Collection (Library of Congress)",This is a tabulation of votes cast by women in Kansas following the passage of municipal suffrage legislation in April 1887. It suggests that women exercised their franchise in a responsible and intelligent manner.,1888]|1888,,Women|Suffrage|Voting|Statistics,,Kansas|Kansas,,,,text,xxu|United States,American Woman Suffrage Association,print,4 p. ; 23 cm.,"general: Caption title.|general: By F.G. Adams.|general: LC copy formerly owned by Lucy Stone.|additional physical form: Also available in digital form on the Library of Congress Web site.|acquisition: Gift; National American Woman Suffrage Association; Nov. 1, 1938. DLC",https://www.loc.gov/item/93838294/,http://cdn.loc.gov/service/rbc/rbnawsa/n8294/001.gif
LoC,93838287/,"The proceedings of the Woman's Rights Convention, held at Worcester, October 15th and 16th, 1851",,"Woman's Rights Convention (1851 : Worcester, Mass.)|Stone, Lucy 1818-1893|National American Woman Suffrage Association Collection (Library of Congress)|Susan B. Anthony Collection (Library of Congress)","This pamphlet includes addresses by Ernestine Rose, Wendell Phillips, and Abby Price, as well as correspondence from Harriet Martineau of England and from Jeanne Deroin Pauline Roland of France.",1852,conference publication,"Women's rights|Women|Legal status, laws, etc",,United States|United States,,,,text,nyu|New York,Published for the Committee by Fowlers and Wells,print,112 p. ; 21 cm.,"general: LC copy formerly owned by Lucy Stone.|additional physical form: Also available in digital form on the Library of Congress Web site.|acquisition: Gift; National American Woman Suffrage Association; Nov. 1, 1938. DLC",https://www.loc.gov/item/93838287/,http://cdn.loc.gov/service/rbc/rbnawsa/n8287/001.gif
LoC,93838288/,"Proceedings of the National Women's Rights Convention held at Cleveland, Ohio, on Wednesday, Thursday, and Friday, October 5th, 6th, and 7th, 1853",,"National Woman's Rights Convention (1853 : Cleveland, Ohio)|Stone, Lucy 1818-1893|National American Woman Suffrage Association Collection (Library of Congress)|Susan B. Anthony Collection (Library of Congress)","This pamphlet addresses a variety of different problems facing women in the nineteenth century, including equal access to education and employment, reform of laws governing marriage and divorce, and concerns about prostitution and temperance. One issue discussed at this convention was women's right to vote.",1854,conference publication,"Women's rights|Women|Legal status, laws, etc",,United States|United States,,,,text,ohu|Cleveland,"Gray, Beardsley, Spear, & Co.",print,188 p. ; 21 cm.,"statement of responsibility: phonographically reported by T.C. Leland, of New York City.|general: ""Published for the Committee.""|general: LC copy formerly owned by Lucy Stone.|additional physical form: Also available in digital form on the Library of Congress Web site.|acquisition: Gift; National American Woman Suffrage Association; Nov. 1, 1938. DLC",https://www.loc.gov/item/93838288/,http://cdn.loc.gov/service/rbc/rbnawsa/n8288/001.gif
LoC,93838289/,"Proceedings of the Woman's Rights Convention held at the Broadway Tabernacle, in the city of New York, on Tuesday and Wednesday, Sept. 6th and 7th, 1853",,"Woman's Rights Convention (1853 : New York, N.Y.)|Stone, Lucy 1818-1893|National American Woman Suffrage Association Collection (Library of Congress)|Susan B. Anthony Collection (Library of Congress)","This pamphlet contains addresses by William Lloyd Garrison, Sojourner Truth, Lucy Stone, and C.C. Burleigh.",1853,conference publication,"Women's rights|Women|Legal status, laws, etc",,United States|United States,,,,text,nyu|New York,"Published for the Committee|Fowlers and Wells, Publishers",print,96 p. ; 21 cm.,"general: LC copy formerly owned by Lucy Stone.|additional physical form: Also available in digital form on the Library of Congress Web site.|acquisition: Gift; National American Woman Suffrage Association; Nov. 1, 1938. DLC",https://www.loc.gov/item/93838289/,http://cdn.loc.gov/service/rbc/rbnawsa/n8289/001.gif
LoC,93838290/,"Proceedings of the Ninth National Woman's Rights Convention held in New York City, Thursday, May 12, 1859: with a phonographic report of the speech of Wendell Phillips",,"National Woman's Rights Convention (1859 : New York, N.Y.)|Stone, Lucy 1818-1893|National American Woman Suffrage Association Collection (Library of Congress)|Susan B. Anthony Collection (Library of Congress)",This pamphlet contains a speech by Wendell Phillips advocating for women's enfranchisement.,1859,conference publication,"Women's rights|Women|Legal status, laws, etc",,United States|United States,,,,text,"nyu|Rochester, N.Y",Steam Press of A. Strong & Co.,print,20 p. ; 21 cm.,"statement of responsibility: by J.M.W. Yerrinton.|general: ""Published for the Convention.""|general: LC copy formerly owned by Lucy Stone.|additional physical form: Also available in digital form on the Library of Congress Web site.|acquisition: Gift; National American Woman Suffrage Association; Nov. 1, 1938. DLC",https://www.loc.gov/item/93838290/,http://cdn.loc.gov/service/rbc/rbnawsa/n8290/001.gif
LoC,93838291/,Constitution of the American Woman Suffrage Association and the history of its formation: with the times and places in which the association has held meetings up to 1880,,"American Woman Suffrage Association|Stone, Lucy 1818-1893|National American Woman Suffrage Association Collection (Library of Congress)",,1881,,History,National American Woman Suffrage Association|National American Woman Suffrage Association,,,19th century,,text,mau|Boston,Press of George H. Ellis,print,8 p. ; 19 cm.,"general: LC copy formerly owned by Lucy Stone.|additional physical form: Also available in digital form on the Library of Congress Web site.|acquisition: Gift; National American Woman Suffrage Association; Nov. 1, 1938. DLC",https://www.loc.gov/item/93838291/,http://cdn.loc.gov/service/rbc/rbnawsa/n8291/001.gif
LoC,tmp80018697/,An appeal to the women of the United States,,"National Woman Suffrage and Educational Committee|Stone, Lucy 1818-1893|Susan B. Anthony Collection (Library of Congress)|National American Woman Suffrage Association Collection (Library of Congress)",The appeal argues that women were already enfranchised by the Fourteenth and Fifteenth Amendments.,1871,,,,,,,,text,ctu|Hartford,"Case, Lockwood & Brainard, Printers",print,4 p. ; 23 cm.,"statement of responsibility: by the National Woman Suffrage and Educational Committee, Washington, D.C. ...|general: LC copy formerly owned by Lucy Stone.|additional physical form: Also available in digital form on the Library of Congress Web site.|acquisition: Gift; National American Woman Suffrage Association; Nov. 1, 1938. DLC",https://www.loc.gov/item/tmp80018697/,http://cdn.loc.gov/service/rbc/rbnawsa/n8697/001.gif
LoC,93838295/,"Senate, no. 343, Commonwealth of Massachusetts, in Senate, May 24, 1869",Suffrage to women,"Massachusetts General Court. Joint Special Committee on Woman's Suffrage.|Stone, Lucy 1818-1893|National American Woman Suffrage Association Collection (Library of Congress)",This pamphlet contains the action concerning a proposal submitted in 1869 to amend the Massachusetts state constitution to enfranchise women.,1869]|1869,government publication,Women|Suffrage|Women's rights,,Massachusetts|Massachusetts,,,,text,mau|Boston,"Commonwealth of Massachusetts, Massachusetts Senate",print,32 p. ; 23 cm.,"general: Caption title.|general: LC copy formerly owned by Lucy Stone.|additional physical form: Also available in digital form on the Library of Congress Web site.|acquisition: Gift; National American Woman Suffrage Association; Nov. 1, 1938. DLC",https://www.loc.gov/item/93838295/,http://cdn.loc.gov/service/rbc/rbnawsa/n8295/001.gif
LoC,93838297/,Uncivil liberty: an essay to show the injustice and impolicy of ruling woman against her consent,,"Heywood, Ezra H. (Ezra Hervey) 1829-1893|Stone, Lucy 1818-1893|National American Woman Suffrage Association Collection (Library of Congress)",,1871,,"Women's rights|Women|Legal status, laws, etc",,United States|United States,,,,text,"mau|Princeton, Mass",Coöperative Publishing Company,print,23 p. ; 23 cm.,"statement of responsibility: by E.H. Heywood ...|general: LC copy formerly owned by Lucy Stone.|additional physical form: Also available in digital form on the Library of Congress Web site.|acquisition: Gift; National American Woman Suffrage Association; Nov. 1, 1938. DLC",https://www.loc.gov/item/93838297/,http://cdn.loc.gov/service/rbc/rbnawsa/n8297/001.gif
LoC,93838311/,The true woman: a series of discourses : to which is added Woman vs. ballot,,"Fulton, Justin D. (Justin Dewey) 1828-1901|Stone, Lucy 1818-1893|Fulton, Justin D. (Justin Dewey) 1828-1901|National American Woman Suffrage Association Collection (Library of Congress)","Justin D. Fulton was pastor of the Union Temple Baptist Church in Boston, Massachusetts. His pamphlet employs traditional arguments from scripture as evidence for why women should not be enfranchised.",1869,,Women|Religious aspects|Christianity|Women|Social and moral questions|Husband and wife|Women's rights|Women|Suffrage,,,,,,text,mau|Boston,Lee and Shepard,print,"xii, 213, 48 p. ; 17 cm.","statement of responsibility: by J.D. Fulton.|general: LC copy formerly owned by Lucy Stone.|additional physical form: Also available in digital form on the Library of Congress Web site.|acquisition: Gift; National American Woman Suffrage Association; Nov. 1, 1938. DLC",https://www.loc.gov/item/93838311/,http://cdn.loc.gov/service/rbc/rbnawsa/n8311/001.gif
