Source,Primary ID,Title,Alternative title,Contributor,Abstract,Date,Genre,Topical subject,Name subject,Geographic subject,Title subject,Temporal subject,Language,Type of resource,Place of publication,Publisher,Form,Extent,Notes,Link,Image
LoC,93838312/,"That terrible question, or, A few thoughts on love and marriage",Terrible question|Few thoughts on love and marriage|Love and marriage,"Hull, Moses 1835-1907|Hull, Moses 1835-1907|Stone, Lucy 1818-1893|National American Woman Suffrage Association Collection (Library of Congress)",This pamphlet by an abolitionist argues that women are enslaved by marriage.,1868,,Marriage|Women|Crimes against,,,,,,text,ilu|Chicago,"Hazlitt & Reed, Printers",print,"24, 12 p. ; 18 cm.","statement of responsibility: by Moses Hull.|general: Includes author's The social evil (p. 1-12 at end).|general: LC copy formerly owned by Lucy Stone.|additional physical form: Also available in digital form on the Library of Congress Web site.|acquisition: Gift; National American Woman Suffrage Association; Nov. 1, 1938. DLC",https://www.loc.gov/item/93838312/,http://cdn.loc.gov/service/rbc/rbnawsa/n8312/001.gif
LoC,93838319/,"Enfranchisement of women: reprinted from the Westminster and foreign quarterly review, for July, 1851",Westminster and foreign quarterly review,"Stone, Lucy 1818-1893|National American Woman Suffrage Association Collection (Library of Congress)","This was reprinted from ""Westminster and Foreign Quarterly Review,"" July 1851, and was intended for a European audience.",1852]|1852,,Feminism|Women's rights,,United States|United States,,,,text,nyu|Syracuse,Lathrop's Print,print,24 p. ; 21 cm.,"general: Caption title.|general: LC copy formerly owned by Lucy Stone.|additional physical form: Also available in digital form on the Library of Congress Web site.|acquisition: Gift; National American Woman Suffrage Association; Nov. 1, 1938. DLC",https://www.loc.gov/item/93838319/,http://cdn.loc.gov/service/rbc/rbnawsa/n8319/001.gif
LoC,93838320/,"Convention ... no. 97, Commonwealth of Massachusetts, in Convention, July 1, 1853",,"Massachusetts Constitutional Convention Committee on Qualifications of Voters. (1853).|Stone, Lucy 1818-1893|National American Woman Suffrage Association Collection (Library of Congress)",Report of the Committee recommending suffrage for women in Massachusetts.,1853]|1853,government publication,Women|Suffrage,Massachusetts.,Massachusetts,Constitution,,,text,mau|Boston,The Convention,print,3 p. ; 21 cm.,"general: Caption title.|general: LC copy formerly owned by Lucy Stone.|additional physical form: Also available in digital form on the Library of Congress Web site.|acquisition: Gift; National American Woman Suffrage Association; Nov. 1, 1938. DLC|general: With: The Whole World's Temperance Convention, held at Metropolitan Hall in the city of New York ... Sept. 1st and 2d, 1853 ... New York : Fowlers and Wells, 1853. DLC",https://www.loc.gov/item/93838320/,http://cdn.loc.gov/service/rbc/rbnawsa/n8320/001.gif
LoC,93838317/,"The proceedings of the Woman's Rights Convention, held at Akron, Ohio, May 28 and 29, 1851",,"Woman's Rights Convention (1851 : Akron, Ohio)|Stone, Lucy 1818-1893|National American Woman Suffrage Association Collection (Library of Congress)|Susan B. Anthony Collection (Library of Congress)","This state conference included reports on education, labor, and common law, as well as letters from Elizabeth Cady Stanton and Amelia Bloomer.",1851,conference publication,"Women's rights|Women|Legal status, laws, etc",,United States|United States,,,,text,ohu|Cincinnati,Ben Franklin Book and Job Office,print,52 p. ; 21 cm.,"general: LC copy formerly owned by Lucy Stone.|additional physical form: Also available in digital form on the Library of Congress Web site.|acquisition: Gift; National American Woman Suffrage Association; Nov. 1, 1938. DLC",https://www.loc.gov/item/93838317/,http://cdn.loc.gov/service/rbc/rbnawsa/n8317/001.gif
LoC,93838318/,"Review of Horace Mann's two lectures: delivered in New-York, February 17th and 29th, 1852",,"Rose, Ernestine L. (Ernestine Louise) 1810-1892|Stone, Lucy 1818-1893|National American Woman Suffrage Association Collection (Library of Congress)","This is a scathing attack on two lectures delivered by educator Horace Mann, entitled ""Hints to a young woman."" Among her other accomplishments, Ernestine Rose worked for passage of the Married Women's Property Act in New York. This act was passed in 1860.",1852]|1852,,Women's rights|Clothing and dress|Social aspects,,,,,,text,nyu|New York,s.n.,print,15 p. ; 21 cm.,"statement of responsibility: by Ernestine L. Rose.|general: Caption title.|general: LC copy formerly owned by Lucy Stone.|additional physical form: Also available in digital form on the Library of Congress Web site.|acquisition: Gift; National American Woman Suffrage Association; Nov. 1, 1938. DLC",https://www.loc.gov/item/93838318/,http://cdn.loc.gov/service/rbc/rbnawsa/n8318/001.gif
LoC,93838345/,"Handbook of the National American Woman Suffrage Association: and proceedings of the Convention held at Cleveland, Ohio, April 13, 1921",,"National American Woman Suffrage Association|Shuler, Nettie Rogers 1865-1939|National American Woman Suffrage Association Convention (52nd : 1921 : Cleveland, Ohio)|National American Woman Suffrage Association Collection (Library of Congress)","This is NAWSA's final report. With the ratification of the Nineteenth Amendment in 1920, its work came to a close and the association was reorganized as the League of Women Voters.",[1921]|1921,conference publication,"Women|Suffrage|Women|Legal status, laws, etc",National American Woman Suffrage Association,United States|United States,,,,text,nyu|New York City,National American Woman Suffrage Association,print,36 p. ; 23 cm.,"statement of responsibility: edited by Nettie Rogers Shuler.|additional physical form: Also available in digital form on the Library of Congress Web site.|acquisition: Gift; National American Woman Suffrage Association; Nov. 1, 1938. DLC",https://www.loc.gov/item/93838345/,http://cdn.loc.gov/service/rbc/rbnawsa/n8345/001.gif
LoC,93838348/,"Woman suffrage: Mr. Caswell, from the Committee on the Judiciary, submitted the following report to accompany H. Res. 60",,"United States Congress. House. Committee on the Judiciary.|Caswell, Lucien B. (Lucien Bonaparte) 1827-1919|Shaw, Anna Howard 1847-1919|National American Woman Suffrage Association Collection (Library of Congress)",,1890,,Women|Suffrage,,United States,,,,text,dcu|Washington,Government Printing Office],print,4 p. ; 23 cm.,"general: Caption title.|general: ""May 29th, 1890, referred to the House Calendar and ordered to be printed.""|general: LC copy is [no. 10] in a vol. with binder's title: Senator Sumner's 1869 and reports and hearings to 1902. Binding: inscribed by Susan B. Anthony. From the library of Anna H. Shaw. NAWSA bookplate.|additional physical form: Also available in digital form on the Library of Congress Web site.|acquisition: Gift; National American Woman Suffrage Association; Nov. 1, 1938. DLC",https://www.loc.gov/item/93838348/,http://cdn.loc.gov/service/rbc/rbnawsa/n8348/001.gif
LoC,93838350/,"Mr. Warren, from the Select Committee on Woman Suffrage, submitted the following report to accompany S.R. 129",,"United States Congress. Senate. Committee on Woman Suffrage.|Warren, Francis E. (Francis Emroy) 1844-1929|Shaw, Anna Howard 1847-1919|National American Woman Suffrage Association Collection (Library of Congress)",,1893,government publication,Women|Suffrage|Women|Suffrage,,United States|Wyoming,,,,text,dcu|Washington,Government Printing Office],print,4 p. ; 23 cm.,"general: Caption title.|general: ""Calendar no. 1174.""|general: LC copy is [no. 11] in a vol. with binder's title: Senator Sumner's 1869 and reports and hearings to 1902. Binding: inscribed by Susan B. Anthony. From the library of Anna H. Shaw. NAWSA bookplate.|additional physical form: Also available in digital form on the Library of Congress Web site.|acquisition: Gift; National American Woman Suffrage Association; Nov. 1, 1938. DLC",https://www.loc.gov/item/93838350/,http://cdn.loc.gov/service/rbc/rbnawsa/n8350/001.gif
LoC,93838349/,"Hearing before the Committee on Woman Suffrage, February 21, 1894",,"United States Congress. Senate. Committee on Woman Suffrage.|Shaw, Anna Howard 1847-1919|National American Woman Suffrage Association Collection (Library of Congress)",,1894,government publication,Women|Suffrage,,United States,,,,text,dcu|Washington,Government Printing Office],print,"30, [1] p. ; 23 cm.","general: Caption title.|general: At head of title: ""In the Senate of the United States.""|general: This pamphlet contains brief remarks by Ida Hulton, Alice Stone Blackwell, and Anna Shaw.|general: LC copy is [no. 13] in a vol. with binder's title: Senator Sumner's 1869 and reports and hearings to 1902. Binding: inscribed by Susan B. Anthony. From the library of Anna H. Shaw. NAWSA bookplate.|general: Includes index.|additional physical form: Also available in digital form on the Library of Congress Web site.|acquisition: Gift; National American Woman Suffrage Association; Nov. 1, 1938. DLC",https://www.loc.gov/item/93838349/,http://cdn.loc.gov/service/rbc/rbnawsa/n8349/001.gif
LoC,93838343/,"Report of hearing before the Committee on Woman Suffrage, January 28, 1896",,"United States Congress. Senate. Committee on Woman Suffrage.|Shaw, Anna Howard 1847-1919|National American Woman Suffrage Association Collection (Library of Congress)|Susan B. Anthony Collection (Library of Congress)",,1896,government publication,Women|Suffrage,,United States,,,,text,dcu|Washington,Government Printing Office,print,23 p. ; 23 cm.,"general: LC copy is [no. 14] in a vol. with binder's title: Senator Sumner's 1869 and reports and hearings to 1902. Binding: inscribed by Susan B. Anthony. From the library of Anna H. Shaw. NAWSA bookplate.|additional physical form: Also available in digital form on the Library of Congress Web site.|acquisition: Gift; National American Woman Suffrage Association; Nov. 1, 1938. DLC",https://www.loc.gov/item/93838343/,http://cdn.loc.gov/service/rbc/rbnawsa/n8343/001.gif
LoC,93838339/,Congressional reports in favor of an amendment to the national constitution prohibiting the disfranchisement of United States citizens on account of sex,,National American Woman Suffrage Association|National American Woman Suffrage Association Collection (Library of Congress)|Susan B. Anthony Collection (Library of Congress),,[1899?]|1899,,Women|Suffrage,,United States,,,,text,nyu|New York City,National American Woman Suffrage Association,print,12 p. ; 23 cm.,"general: Caption title.|general: LC copy is [no. 22] in a vol. with binder's title: Senator Sumner's 1869 and reports and hearings to 1902. Binding: inscribed by Susan B. Anthony. From the library of Anna H. Shaw. NAWSA bookplate.|additional physical form: Also available in digital form on the Library of Congress Web site.|acquisition: Gift; National American Woman Suffrage Association; Nov. 1, 1938. DLC",https://www.loc.gov/item/93838339/,http://cdn.loc.gov/service/rbc/rbnawsa/n8339/001.gif
LoC,93838359/,"Mr. Wadleigh, from the Committee on Privileges and Elections, submitted the following report to accompany bill S. Res. 12",,"United States Congress. Senate. Committee on Privileges and Elections.|Wadleigh, Bainbridge 1831-1891|Shaw, Anna Howard 1847-1919|National American Woman Suffrage Association Collection (Library of Congress)",,1878,government publication,Women|Suffrage,,United States,,,,text,dcu|Washington,Government Printing Office],print,2 p. ; 23 cm.,"general: Caption title.|general: At head of title: ""In the Senate of the United States, June 14, 1878 ...""|general: LC copy is [no. 3] in a vol. with binder's title: Senator Sumner's 1869 and reports and hearings to 1902. Binding: inscribed by Susan B. Anthony. From the library of Anna H. Shaw. NAWSA bookplate.|additional physical form: Also available in digital form on the Library of Congress Web site.|acquisition: Gift; National American Woman Suffrage Association; Nov. 1, 1938. DLC",https://www.loc.gov/item/93838359/,http://cdn.loc.gov/service/rbc/rbnawsa/n8359/001.gif
LoC,93838360/,"Woman suffrage in the U.S. Senate, 1879: argument for a sixteenth amendment",,"United States Congress. Senate. Committee on Privileges and Elections.|Hoar, George Frisbie 1826-1904|Mitchell, John H. (John Hipple) 1835-1905|Cameron, Angus 1826-1897|Shaw, Anna Howard 1847-1919|National American Woman Suffrage Association Collection (Library of Congress)",,1879]|1879,government publication,Women|Suffrage,,United States,,,,text,"dcu|Washington, D.C.?",Government Printing Office,print,6 p. ; 23 cm.,"general: Caption title.|general: Signed: Geo. F. Hoar, John H. Mitchell, Angus Cameron.--p. 6.|general: LC copy is [no. 4] in a vol. with binder's title: Senator Sumner's 1869 and reports and hearings to 1902. Binding: inscribed by Susan B. Anthony. From the library of Anna H. Shaw. NAWSA bookplate.|additional physical form: Also available in digital form on the Library of Congress Web site.|acquisition: Gift; National American Woman Suffrage Association; Nov. 1, 1938. DLC",https://www.loc.gov/item/93838360/,http://cdn.loc.gov/service/rbc/rbnawsa/n8360/001.gif
LoC,93838338/,"Congressional action in the first session of the 48th Congress, 1883, 1884",,"United States Congress (48th, 1st session : 1883-1884)|Anthony, Susan B. (Susan Brownell) 1820-1906|National American Woman Suffrage Association Collection (Library of Congress)|Susan B. Anthony Collection (Library of Congress)",,1884]|1884,government publication,Women|Suffrage,,United States,,,,text,dcu|Washington,Government Printing Office,print,70 p. ; 23 cm.,"general: Caption title.|general: LC copy is [no. 5] in a vol. with binder's title: Senator Sumner's 1869 and reports and hearings to 1902. Binding: inscribed by Susan B. Anthony. From the library of Anna H. Shaw. NAWSA bookplate.|additional physical form: Also available in digital form on the Library of Congress Web site.|acquisition: Gift; National American Woman Suffrage Association; Nov. 1, 1938. DLC",https://www.loc.gov/item/93838338/,http://cdn.loc.gov/service/rbc/rbnawsa/n8338/001.gif
LoC,93838342/,"Universal suffrage: speech of Hon. Thomas W. Palmer of Michigan in the Senate of the United States, Friday, February 6, 1885",,"Palmer, Thomas W. (Thomas Witherell) 1830-1913|United States Congress Senate. (48th, 2nd session : 1884-1885).|National American Woman Suffrage Association Collection (Library of Congress)|Susan B. Anthony Collection (Library of Congress)",,1885]|1885,government publication,Women|Suffrage,,United States,,,,text,dcu|Washington,Government Printing Office,print,8 p. ; 23 cm.,"general: Caption title.|general: LC copy is [no. 6] in a vol. with binder's title: Senator Sumner's 1869 and reports and hearings to 1902. Binding: inscribed by Susan B. Anthony. From the library of Anna H. Shaw. NAWSA bookplate.|additional physical form: Also available in digital form on the Library of Congress Web site.|acquisition: Gift; National American Woman Suffrage Association; Nov. 1, 1938. DLC",https://www.loc.gov/item/93838342/,http://cdn.loc.gov/service/rbc/rbnawsa/n8342/001.gif
LoC,93838362/,Woman suffrage: views of the minority,,"United States Congress. House.|Taylor, Ezra B. (Ezra Booth) 1823-1912|Hepburn, (William Peters) Mr 1833-1916|Caswell, Lucien B. (Lucien Bonaparte) 1827-1919|Ranney, A. A. (Ambrose Arnold) 1821-1899|National American Woman Suffrage Association Collection (Library of Congress)|Susan B. Anthony Collection (Library of Congress)",,1886?],government publication,Women|Suffrage,,United States,,,,text,dcu|Washington,Government Printing Office,print,3 p. ; 23 cm.,"general: Caption title.|general: Signed: E.B. Taylor, W.P. Hepburn, L.B. Caswell, with concurrence: A.A. Ranney.--p. 3.|general: LC copy is [no. 7] in a vol. with binder's title: Senator Sumner's 1869 and reports and hearings to 1902. Binding: inscribed by Susan B. Anthony. From the library of Anna H. Shaw. NAWSA bookplate.|additional physical form: Also available in digital form on the Library of Congress Web site.|acquisition: Gift; National American Woman Suffrage Association; Nov. 1, 1938. DLC",https://www.loc.gov/item/93838362/,http://cdn.loc.gov/service/rbc/rbnawsa/n8362/001.gif
LoC,93838351/,"Mr. Blair, from the Committee on Woman Suffrage, submitted the following report to accompany S. Res. 1",,"United States Congress. Senate. Committee on Woman Suffrage.|Blair, Henry W. (Henry William) 1834-1920|National American Woman Suffrage Association Collection (Library of Congress)|Susan B. Anthony Collection (Library of Congress)",,1890,government publication,Women|Suffrage,,United States,,,,text,dcu|Washington,Government Printing Office],print,4 p. ; 23 cm.,"general: Caption title.|general: At head of title: ""In the Senate of the United States, August 12, 1890...""|general: Signed at end: Henry W. Blair, for the majority of the committee.|general: LC copy is [no. 9] in a vol. with binder's title: Senator Sumner's 1869 and reports and hearings to 1902. Binding: inscribed by Susan B. Anthony. From the library of Anna H. Shaw. NAWSA bookplate.|additional physical form: Also available in digital form on the Library of Congress Web site.|acquisition: Gift; National American Woman Suffrage Association; Nov. 1, 1938. DLC",https://www.loc.gov/item/93838351/,http://cdn.loc.gov/service/rbc/rbnawsa/n8351/001.gif
LoC,93838346/,Bible and church degrade woman,,"Stanton, Elizabeth Cady 1815-1902|Catt, Carrie Chapman 1859-1947|National American Woman Suffrage Association Collection (Library of Congress)","In 1895, Elizabeth Cady Stanton published the first edition of ""The Woman's Bible,"" an attempt to amplify, explain, and redefine scriptural references pertaining to women in the basis that these were often used as a rationale to deny women particular rights and privileges. The work was undertaken by a committee and involved searching the both Old and New Testaments for references to women, cutting them out, and then pasting them on blank pages in a book. Then commentaries were added beneath the quotations. In 1898, ""The Woman's Bible"" was reprinted, including the addition of a 20-page pamphlet entitled, ""Bible and church degrade woman,"" which contained three essays by Stanton that further explained her position on women in religion. This is one of those essays.",[1898?]|1898,,Women's rights|Religious aspects|Women in the Bible,,,,,,text,"ilu|Chicago, Ill","H.L. Green, Publisher",print,20 p. : 1 port. ; 22 cm.,"statement of responsibility: by Elizabeth Cady Stanton.|general: LC copy inscribed by author. Bookplate: library, Carrie Chapman Catt.|additional physical form: Also available in digital form on the Library of Congress Web site.|acquisition: Gift; National American Woman Suffrage Association; Nov. 1, 1938. DLC|general: With: The Woman's Bible. New York : European Publishing Co., 1898. Bound together subsequent to publication. DLC",https://www.loc.gov/item/93838346/,http://cdn.loc.gov/service/rbc/rbnawsa/n8346/001.gif
LoC,93838344/,Shall women have the right to vote?,,"Phillips, Wendell 1811-1884|Catt, Carrie Chapman 1859-1947|National American Woman Suffrage Association Collection (Library of Congress)","Wendell Phillips was an abolitionist and an early advocate of woman suffrage. This pamphlet is a 1910 reprint of an early speech on this topic with a brief foreword by ""S.Y.S.""",1910,,Women|Suffrage|Women's rights,,United States|United States,,,,text,pau|Philadelphia],Republished by The Equal Franchise Society of Pennsylvania,print,28 p. ; 22 cm.,"statement of responsibility: address by Wendell Phillips at Worcester, Mass, 1851.|general: LC copy has bookplate: library, Carrie Chapman Catt.|additional physical form: Also available in digital form on the Library of Congress Web site.|acquisition: Gift; National American Woman Suffrage Association; Nov. 1, 1938. DLC",https://www.loc.gov/item/93838344/,http://cdn.loc.gov/service/rbc/rbnawsa/n8344/001.gif
LoC,93838333/,"The constitutional rights of the women of the United States: an address before the International Council of Women, Washington, D.C., March 30, 1888",,"Hooker, Isabella Beecher 1822-1907|Catt, Carrie Chapman 1859-1947|National American Woman Suffrage Association Collection (Library of Congress)|Susan B. Anthony Collection (Library of Congress)",This speech focuses on the argument that nothing in the Constitution specifically denies women the right to vote and advocates that women exercise that right whenever possible. A portion of the talk is devoted to Susan B. Anthony's arrest and trial for attempting to vote in the state of New York.,1900,,"Trials, litigation, etc|Women|Suffrage","Anthony, Susan B. (Susan Brownell) 1820-1906",United States,,,,text,"ctu|Hartford, Conn.]","Hartford Press|The Case, Lockwood & Brainard Company",print,37 p. ; 24 cm.,"statement of responsibility: by Isabella Beecher Hooker.|general: Cover title.|general: LC copy has bookplate: library, Carrie Chapman Catt.|additional physical form: Also available in digital form on the Library of Congress Web site.|acquisition: Gift; National American Woman Suffrage Association; Nov. 1, 1938. DLC",https://www.loc.gov/item/93838333/,http://cdn.loc.gov/service/rbc/rbnawsa/n8333/001.gif
LoC,93838358/,Solitude of self,,"Stanton, Elizabeth Cady 1815-1902|Catt, Carrie Chapman 1859-1947|United States Congress House. Committee of the Judiciary. (52nd, 1st session : 1891-1892).|National American Woman Suffrage Association Collection (Library of Congress)",Stanton's classic argument for why women need to be enfranchised by a Sixteenth Amendment.,1915]|1915,government publication,"Women's rights|Women|Legal status, laws, etc",,United States|United States,,,,text,dcu|Washington,Government Printing Office.,print,8 p. : 1 port. ; 23 cm.,"statement of responsibility: address delivered by Mrs. Stanton before the Committee of the Judiciary of the United States Congress, Monday, January 18, 1892.|general: ""Reprinted from the Congressional record and presented as a birthday centennial gift.""|general: LC copy has bookplate: library, Carrie Chapman Catt.|additional physical form: Also available in digital form on the Library of Congress Web site.|acquisition: Gift; National American Woman Suffrage Association; Nov. 1, 1938. DLC",https://www.loc.gov/item/93838358/,http://cdn.loc.gov/service/rbc/rbnawsa/n8358/001.gif
LoC,93838363/,"The Ohio convention reporter, Vol. 1, no. 2, February 1870",,"Catt, Carrie Chapman 1859-1947|National American Woman Suffrage Association Collection (Library of Congress)","This publication proposes to cover all of the major conventions taking place in Ohio. In the March, 1870, issue, it published the proceedings of the Ohio Woman Suffrage Convention. Lucy Stone was a keynote speaker.",1870,,Women|Suffrage,"Ohio Woman Suffrage Convention (1870 : Columbus, Ohio)",Ohio|Ohio,,,,text,"ohu|Columbus, Ohio",Published by J.G. Adel & Co.,print,p. 98-136 ; 24 cm,"general: Cover title.|general: LC copy has bookplate : library, Carrie Chapman Catt.|additional physical form: Also available in digital form on the Library of Congress Web site.|acquisition: Gift; National American Woman Suffrage Association; Nov. 1, 1938. DLC",https://www.loc.gov/item/93838363/,http://cdn.loc.gov/service/rbc/rbnawsa/n8363/001.gif
LoC,93838335/,"Legislative wrongs to labor and how to right them: address delivered before the committees of the Constitutional Convention of Pennsylvania, in Constitutional Hall, January 31, 1873","Address delivered before the committees of the Constitutional Convention of Pennsylvania, in Constitutional Hall, January 31, 1873","Kilgore, Damon Y. (Damon Young) 1827-1888|Catt, Carrie Chapman 1859-1947|National American Woman Suffrage Association Collection (Library of Congress)",The message of this pamphlet is that all women in Pennsylvania must be enfranchised under the new state constitution to keep business interests--in this specific case the railroads and the coal mines--from running roughshod over the rights of the working class.,1873,,Women|Suffrage|Corporations|Taxation|Law and legislation,,Pennsylvania|Pennsylvania,,,,text,pau|Philadelphia,Co-operative Printing Co.,print,16 p. ; 24 cm.,"statement of responsibility: by Damon Y. Kilgore, chairman, Committee on Legislation, in section, of the International Workingmen's Association, of the North American Confederation.|general: LC copy has bookplate: library, Carrie Chapman Catt.|additional physical form: Also available in digital form on the Library of Congress Web site.|acquisition: Gift; National American Woman Suffrage Association; Nov. 1, 1938. DLC",https://www.loc.gov/item/93838335/,http://cdn.loc.gov/service/rbc/rbnawsa/n8335/001.gif
LoC,93838361/,Front door lobby,,"Park, Maud Wood 1871-1955|Catt, Carrie Chapman 1859-1947|National American Woman Suffrage Association Collection (Library of Congress)",This is an original manuscript of Park's account of her work on the NAWSA Congressional Committee.,[S.l|192-]|1920 - 1929,,Women|Suffrage|Lobbying,National American Woman Suffrage Association. Congressional Committee.,United States|Washington (D.C.),,,,text,xxu,s.n.,print,"x, 308 leaves ; 29 cm.","statement of responsibility: by Maud Wood Park.|general: Typescript.|general: LC copy has bookplate: Carrie Chapman Catt.|additional physical form: Also available in digital form on the Library of Congress Web site.|acquisition: Gift; National American Woman Suffrage Association; Nov. 1, 1938. DLC",https://www.loc.gov/item/93838361/,http://cdn.loc.gov/service/rbc/rbnawsa/n8361/001.gif
