Source,Primary ID,Title,Alternative title,Contributor,Abstract,Date,Genre,Topical subject,Name subject,Geographic subject,Title subject,Temporal subject,Language,Type of resource,Place of publication,Publisher,Form,Extent,Notes,Link,Image
LoC,18012004/,Mobilizing woman-power,,"Blatch, Harriot Stanton 1856-1940|Catt, Carrie Chapman 1859-1947|National American Woman Suffrage Association Collection (Library of Congress)","This book by Elizabeth Cady Stanton's daughter emphasizes the importance of women's contributions to World War I. It helps demostrate the link British and American suffragists were making between wartime sacrifice and women's disenfranchisement. There is an interesting foreword by Theodore Roosevelt, which reveals his position on woman suffrage.",1918,,"World War, 1914-1918|Women",,,,,,text,nyu|New York,The Womans Press,print,"5 p.l., 5-195 p. : front., plates ; 20 cm.",statement of responsibility: by Harriot Stanton Blatch ; with a foreword by Theodore Roosevelt ; with illustrations.|additional physical form: Also available in digital form on the Library of Congress Web site and on the Internet Archive Web site.,https://www.loc.gov/item/18012004/,http://cdn.loc.gov/service/rbc/rbnawsa/n2004/001.gif
LoC,33001926/,"Proceedings of the Anti-Slavery Convention of American Women, held in Philadelphia. May 15th, 16th, 17th and 18th, 1838",,"Anti-Slavery Convention of American Women (2d : 1838 : Philadelphia, Pa.)|Stone, Lucy 1818-1893|National American Woman Suffrage Association Collection (Library of Congress)",This pamphlet helps to emphasize the relationship between abolitionism and women's rights.,1838,conference publication,Antislavery movements|Slavery,,United States|United States,,,,text,pau|Philadelphia,Printed by Merrihew and Gunn,print,18 p. ; 22 cm.,additional physical form: Also available in digital form.,https://www.loc.gov/item/33001926/,http://cdn.loc.gov/service/rbc/rbnawsa/n1926/001.gif
LoC,23017479/,From pinafores to politics,,"Harriman, Florence Jaffray 1870-1967|Catt, Carrie Chapman 1859-1947|National American Woman Suffrage Association Collection (Library of Congress)","This autobiography details the life of Daisy Hurst (Mrs. J. Borden) Harriman, a wealthy New York woman who worked diligently for issues concerning working-class women. Harriman was one of the women who lent her financial support to the shirtwaist workers' strike in 1909. In addition, with Mrs. Oliver H.P. Belmont and Miss Anne Morgan, she helped organize a strike meeting of the WTUL at the Colony Club, the first women's social club in New York City, which she also helped organize. In 1912, she was named by Woodrow Wilson to serve on the Federal Industrial Relations Commission.",1923,biography,"Women|Political activity|World War, 1914-1918|Politics and government|Social life and customs","Harriman, Florence Jaffray 1870-1967",United States|United States|Washington (D.C.),,1913-1921,,text,nyu|New York,Henry Holt and Company,print,"4 p.l., 359 p. : front., plates (part fold.), ports. ; 24 cm.",statement of responsibility: by Mrs. J. Borden Harriman.|general: Illustrated lining-papers.|additional physical form: Also available in digital form on the Library of Congress Web site.,https://www.loc.gov/item/23017479/,http://cdn.loc.gov/service/rbc/rbnawsa/n7479/001.gif
LoC,15024465/,The trade union woman,,"Henry, Alice 1857-1943|Catt, Carrie Chapman 1859-1947|National American Woman Suffrage Association Collection (Library of Congress)",The book examines the history of women's labor organizations and the relationship of working-class women to the campaign for woman suffrage.,1915,,Women labor union members|Women in the labor movement|Women|Suffrage,,United States|United States|United States,,,,text,nyu|New York|London,D. Appleton and Company,print,"xxiv p., 1 l., 314 p.  : front., plates ; 20 cm.","statement of responsibility: by Alice Henry, member of Office Employés' [sic] Association of Chicago, No. 12755, and formerly editor of Life and labor.|bibliography: Bibliography: p. 297-303.|additional physical form: Also available in digital form on the Library of Congress Web site.",https://www.loc.gov/item/15024465/,http://cdn.loc.gov/service/rbc/rbnawsa/n4465/001.gif
LoC,08004839/,Taxation of women in Massachusetts,,"Bowditch, William I. (William Ingersoll) 1819-1909|Catt, Carrie Chapman 1859-1947|National American Woman Suffrage Association Collection (Library of Congress)|YA Pamphlet Collection (Library of Congress)",This pamphlet examines the legal and political status of women in Massachusetts from 1780 to 1871. It includes a brief appendix tabulating the amount women have paid in taxes while being denied the right to vote.,1875,,"Women|Legal status, laws, etc|Taxation|Women|Political activity",,Massachusetts|Massachusetts|Massachusetts,,,,text,mau|Cambridge,Press of John Wilson and Son,print,71 p. : tables ; 24 cm.,statement of responsibility: by William I. Bowditch ...|additional physical form: Also available in digital form on the Library of Congress Web site.,https://www.loc.gov/item/08004839/,http://cdn.loc.gov/service/rbc/rbnawsa/n4839/001.gif
LoC,08034439/,"Social evils, their causes and cure: being a brief discussion of the social status, with reference to methods of reform",,"King, Maria M.|Stone, Lucy 1818-1893|National American Woman Suffrage Association Collection (Library of Congress)","In this pamphlet, the author addresses a number of issues contributing to problems in contemporary society, among them poor diet, prostitution, marriage and divorce, the plight of orphans, and women in prisons. She suggests, in part, that better education for women and their enfranchisement will be a part of the remedy for these social evils.",1870,,Social problems|Miscellanea,,,,,,text,mau|Boston|New York,"W. White and Company|The American News Company, Agents",print,55 p. ; 24 cm.,statement of responsibility: by Mrs. Maria M. King ...|additional physical form: Also available in digital form on the Library of Congress Web site.,https://www.loc.gov/item/08034439/,http://cdn.loc.gov/service/rbc/rbnawsa/n4439/001.gif
LoC,ca26000179/,Consistent democracy: the elective franchise for women,,"Stone, Lucy 1818-1893|Susan B. Anthony Collection (Library of Congress)|National American Woman Suffrage Association Collection (Library of Congress)","These are very brief (paragraph-length) statements of support for woman suffrage. Among the ""prominent men"" included are Henry Ward Beecher, William Lloyd Garrison, Horace Greeley, Thomas Wentworth Higginson, Samuel J. May, Theodore Parker, Wendell Phillips, Gerrit Smith, William H. Channing, the Ohio Senate, and the Wisconsin legislature.",1858,,Women|Suffrage,,,,,,text,mau|Worcester|Boston,To be obtained of R.F. Wallcut ...,print,4 p. ; 23 cm.,"statement of responsibility: twenty-five testimonies of prominent men, viz: ex-Gov. Anthony of R.I., Rev. Henry Ward Beecher, Rev. Wm.H. Channing ...|general: LC copy no. 11 in a collection of pamphlets lettered: Miscellaneous speeches, etc.|additional physical form: Also available in digital form on the Library of Congress Web site.",https://www.loc.gov/item/ca26000179/,http://cdn.loc.gov/service/rbc/rbnawsa/n6179/001.gif
LoC,28018616/,"An address on woman's rights: delivered before the people's Sunday meeting, in Cochituate Hall, on Sunday afternoon, Oct. 19th, 1851",,"Rose, Ernestine L. (Ernestine Louise) 1810-1892|Stone, Lucy 1818-1893|Susan B. Anthony Collection (Library of Congress)|National American Woman Suffrage Association Collection (Library of Congress)",,1851,,Women's rights,,United States,,,,text,mau|Boston,Published by J. P. Mendum,print,21 p. ; 18 cm.,"statement of responsibility: by Mrs. E.L. Rose.|general: No. 3 in a vol. with binder's title: Miscellaneous speeches.|additional physical form: Also available in digital form on the Library of Congress Web site, and on microfilm (Microfilm O1291 reel 221, no.10E).",https://www.loc.gov/item/28018616/,http://cdn.loc.gov/service/rbc/rbnawsa/n8616/001.gif
LoC,28018623/,"Powers of Congress to prohibit inequality, caste and oligarchy of the skin",,"Sumner, Charles 1811-1874|Shaw, Anna Howard 1847-1919|United States Congress Senate. (40th, 3rd session : 1868-1869).|Susan B. Anthony Collection (Library of Congress)|National American Woman Suffrage Association Collection (Library of Congress)",,1869,,African Americans|Suffrage|Suffrage,,United States,,,,text,dcu|Washington,F. & J. Rives & G.A. Bailey,print,8 p. ; 23 cm.,"statement of responsibility: speech of Hon. Charles Sumner of Massachusetts, delivered in the Senate of the United States, February 5, 1869.|general: No. 32 in a collection of pamphlets lettered: Miscellaneous pamphlets, etc. Signed and annotated by Susan B. Anthony.|additional physical form: Also available in digital form on the Library of Congress Web site.",https://www.loc.gov/item/28018623/,http://cdn.loc.gov/service/rbc/rbnawsa/n8623/001.gif
LoC,28018620/,"The mortality of nations: an address delivered before the American Equal Rights Association, in New York, Thursday evening, May 9, 1867",,"Pillsbury, Parker 1809-1898|Stone, Lucy 1818-1893|American Equal Rights Association|Susan B. Anthony Collection (Library of Congress)|National American Woman Suffrage Association Collection (Library of Congress)",,1867,,Civilization|History|Women|Suffrage,,United States,,,,text,nyu|New York,"Robert J. Johnston, Printer",print,13 p. ; 23 cm.,"statement of responsibility: by Parker Pillsbury.|general: No. 37 in a collection of pamphlets lettered: Miscellaneous speeches, etc.|additional physical form: Also available in digital form on the Library of Congress Web site.",https://www.loc.gov/item/28018620/,http://cdn.loc.gov/service/rbc/rbnawsa/n8620/001.gif
LoC,tmp83029911/,"Woman's right to preach the gospel: a sermon, preached at the ordination of the Rev. Miss Antoinette L. Brown, at South Butler, Wayne County, N.Y., Sept. 15, 1853",,"Lee, Luther 1800-1889|Stone, Lucy 1818-1893|Susan B. Anthony Collection (Library of Congress)|National American Woman Suffrage Association Collection (Library of Congress)","This sermon was preached at the ordination of Antoinette L. Brown, on 15 September 1853. Brown was one of the first women to be ordained in the Congregational church.",1853,,Women clergy|Congregational churches|Clergy,"Blackwell, Antoinette Louisa Brown 1825-1921",United States,,,,text,"nyu|Syracuse, N.Y",Published by the Author,print,22 p. ; 21 cm.,statement of responsibility: by Rev. Luther Lee ...|general: Lettered on cover: S.B. Anthony.|general: No. 13 in a collection of pamphlets lettered: Tracts and speeches on woman's rights.|additional physical form: Also available in digital form on the Library of Congress Web site.,https://www.loc.gov/item/tmp83029911/,http://cdn.loc.gov/service/rbc/rbnawsa/n9911/001.gif
LoC,37017721/,Woman as God made her: the true woman,,"Fulton, Justin D. (Justin Dewey) 1828-1901|Fulton, Justin D. (Justin Dewey) 1828-1901|National American Woman Suffrage Association Collection (Library of Congress)","Justin D. Fulton was pastor of the Union Temple Baptist Church in Boston, Massachusetts. His pamphlet employs traditional arguments from scripture as evidence for why women should not be enfranchised.",1869,,Women|Social and moral questions|Women|Religious aspects|Christianity|Husband and wife|Women's rights|Women|Suffrage,,,,,,text,mau|Boston,Lee and Shepard,print,"xii, 262 p. ; front. (port.) ; 20 cm.","statement of responsibility: by J.D. Fulton.|general: ""To which is added Woman vs. ballot.""|additional physical form: Also available in digital form on the Library of Congress Web site, and on microfilm (Microfilm 13619 HQ).",https://www.loc.gov/item/37017721/,http://cdn.loc.gov/service/rbc/rbnawsa/n7721/001.gif
LoC,24029000/,"A sermon of the public function of woman: preached at the Music Hall, March 27, 1853",,"Parker, Theodore 1810-1860|Yerrinton, J. M. W. (James Manning Winchell) -1893|Leighton, Rufus.|Stone, Lucy 1818-1893|Miscellaneous Pamphlet Collection (Library of Congress)|National American Woman Suffrage Association Collection (Library of Congress)","This sermon was one of a long series of sermons delivered by Parker on the ""spiritual development of the human race."" In one section containing four sermons devoted to women, Parker argues that women were prevented from voting primarily by the efforts of men.",1853,,Women,,,,,,text,mau|Boston,Robert F. Wallcut,print,20 p. ; 23 cm.,"statement of responsibility: by Theodore Parker, minister of the Twenty-Eighth Congregational Society ; phonographically reported by J.M.W. Yerrinton and Rufus Leighton.|additional physical form: Also available in digital form on the Library of Congress Web site.",https://www.loc.gov/item/24029000/,http://cdn.loc.gov/service/rbc/rbnawsa/n9000/001.gif
LoC,15007485/,American women in civic work,,"Bennett, Helen Christine.|Catt, Carrie Chapman 1859-1947|National American Woman Suffrage Association Collection (Library of Congress)","Each woman included in this book attained some level of prominence in politics, education, or social reform.",1915,biography,Women in public life,,United States,,,,text,nyu|New York,"Dodd, Mead and Company",print,"vi,  3 l., 3-277 p. : ports. (incl. front.) ; 20 cm.","statement of responsibility: by Helen Christine Bennett ; with portraits.|general: ""Portions of the sketches which appear in this book have been published serially, principally in the Pictorial review and the American magazine.""|additional physical form: Also available in digital form on the Library of Congress Web site.",https://www.loc.gov/item/15007485/,http://cdn.loc.gov/service/rbc/rbnawsa/n7485/001.gif
LoC,29012783/,Toward equal rights for men and women,,"Smith, Ethel Marion 1877-1951|Catt, Carrie Chapman 1859-1947|National American Woman Suffrage Association Collection (Library of Congress)","The author of this book, which includes a brief introduction by Sophonisba Breckenridge, maintains that an Equal Rights Amendment, such as the one then being proposed by Alice Paul and the Woman's Party, would lead to chaos and confusion. She argues that absolute equality with men would strip away certain forms of protective legislation from which certain groups of women benefit.",1929,,"Women|Legal status, laws, etc|Women's rights",,United States|United States,,,,text,"dcu|Washington, D.C","Published by the Committee on the Legal Status of Women, National League of Women Voters",print,139 p. ; 23 cm.,"statement of responsibility: by Ethel M. Smith.|bibliography: ""General references"": p. 138-139.|additional physical form: Also available in digital form on the Library of Congress Web site.",https://www.loc.gov/item/29012783/,http://cdn.loc.gov/service/rbc/rbnawsa/n2783/001.gif
LoC,33003563/,Laws affecting women and children in the suffrage and non-suffrage states,,"Porritt, Annie G. (Annie Gertrude) 1861-1932|Catt, Carrie Chapman 1859-1947|National American Woman Suffrage Association Collection (Library of Congress)","This book examines women's legal status in the areas of protective labor legislation for women and children, minimum wage laws, mothers' pensions, the property rights of married women, child custody, age of consent, control of the liquor traffic, and prostitution. Like Jessie Cassidy's ""The legal status of women,"" this volume deals with each of these areas on a state-by-state basis. It includes a black-and-white pinwheel chart showing good and bad legislation affecting women, but few other tables or graphs.",c1917|1917,,"Women|Legal status, laws, etc|Children|Legal status, laws, etc|Women|Suffrage",,United States|United States|United States,,,,text,nyu|New York City,"National Woman Suffrage Publishing Company, Inc.",print,168 p. : illus. ; 24 cm.,"statement of responsibility: by Annie G. Porritt.|general: Part of pages blank for ""Addenda.""|additional physical form: Also available in digital form on the Library of Congress Web site.",https://www.loc.gov/item/33003563/,http://cdn.loc.gov/service/rbc/rbnawsa/n3563/001.gif
LoC,15008748/,"Transactions of the National Council of Women of the United States: assembled in Washington, D.C., February 22 to 25, 1891",,"National Council of Women of the United States Meeting (1st : 1891 : Albaugh's Opera House, Washington, D.C.)|Avery, Rachel Foster 1858-1919|Catt, Carrie Chapman 1859-1947|National American Woman Suffrage Association Collection (Library of Congress)","The National Council of Women of the United States was founded in 1888 by Susan B. Anthony at the suggestion of Elizabeth Cady Stanton. It was an organization composed of national organizations and affiliated associations all pledged to working for issues concerning women, among them, the right to vote. The organization met triennially at first, later biennially.",1891,conference publication,Women|Societies and clubs,,United States,,,,text,pau|Philadelphia,Printed by J.B. Lippincott Company,print,"1 p.l., 5-372 p. : ports. ; 14 cm.","statement of responsibility: edited by Rachel Foster Avery, corresponding secretary.|general: ""Published by order of the Executive Board of the National Council of Women.""|general: The meeting held in 1891 was the first of the triennial sessions held by the Council. Reports of later meetings are included in its ""Report.""|additional physical form: Also available in digital form on the Library of Congress Web site, and on microfilm (Microfilm 30262 HQ).",https://www.loc.gov/item/15008748/,http://cdn.loc.gov/service/rbc/rbnawsa/n8748/001.gif
LoC,27007548/,"The first convention ever called to discuss the civil and political rights of women, Seneca Falls, N.Y., July 19, 20, 1848",,"Woman's Rights Convention (1848 : Seneca Falls, N.Y.)|Stone, Lucy 1818-1893|National American Woman Suffrage Association Collection (Library of Congress)",,after 1848]|1848 - 1899,conference publication,Women's rights,,United States,,,,text,xxu|S.l,s.n.,print,8 p. ; 22 cm.,"statement of responsibility: Woman's Rights Convention.|general: Caption title.|general: ""This call was published in the Seneca County courier, July 14, 1848, without any signatures. The movers of this convention, who drafted the call, the declaration and resolutions were Elizabeth Cady Stanton, Lucretia Mott, Martha C. Wright, Mary Ann McClintock, and Jane C. Hunt""--Footnote.|general: Includes p. [1] first and closing paragraphs of Mrs. Stanton's address.|additional physical form: Also available in digital form on the Library of Congress Web site.",https://www.loc.gov/item/27007548/,http://cdn.loc.gov/service/rbc/rbnawsa/n7548/001.gif
LoC,86182880/,"The proceedings of the Woman's Rights Convention, held at West Chester, Pa., June 2d and 3d, 1852",,"Woman's Rights Convention (1852 : West Chester, Pa.)|Stone, Lucy 1818-1893|National American Woman Suffrage Association Collection (Library of Congress)|Susan B. Anthony Collection (Library of Congress)","This meeting was presided over by Lucretia Mott, who also addressed the assembly.",1852,conference publication,Women's rights,,United States,,,,text,pau|Philadelphia,"Merrihew and Thompson, Printers",print,38 p. ; 21 cm.,general: Cover title.|additional physical form: Also available in digital form on the Library of Congress Web site.,https://www.loc.gov/item/86182880/,http://cdn.loc.gov/service/rbc/rbnawsa/n2880/001.gif
LoC,09002749/,"The rights and condition of women: a sermon, preached in Syracuse, Nov., 1845",,"May, Samuel J. (Samuel Joseph) 1797-1871|Stone, Lucy 1818-1893|National American Woman Suffrage Association Collection (Library of Congress)","Reprint of a sermon delivered by May in Syracuse, New York in November, 1845. It follows the World Anti-Slavery Convention in London in 1840 but precedes the first women's rights convention in America by more than two and a half years.",1853?],,Women's rights,,United States,,,,text,nyu|Syracuse,Lathrop's Print,print,16 p. ; 23 cm.,statement of responsibility: by Samuel J. May.|general: Caption title.|additional physical form: Also available in digital form on the Library of Congress Web site.,https://www.loc.gov/item/09002749/,http://cdn.loc.gov/service/rbc/rbnawsa/n2749/001.gif
LoC,09002748/,Discourse on woman,,"Mott, Lucretia 1793-1880|Stone, Lucy 1818-1893|National American Woman Suffrage Association Collection (Library of Congress)","This lecture by Mott, delivered 17 December 1849, was in response to one by an unidentified lecturer criticizing the demand for equal rights for women. She makes a very gentle appeal here for women's enfranchisement, placing emphasis instead on the injustices done to women in marriage.",1850,,Women's rights,,,,,,text,pau|Philadelphia,T.B. Peterson,print,20 p. ; 23 cm.,"statement of responsibility: by Lucretia Mott ; delivered at the Assembly Buildings, December 17, 1849 ; being a full phonographic report, revised by the author.|additional physical form: Also available in digital form on the Library of Congress Web site.",https://www.loc.gov/item/09002748/,http://cdn.loc.gov/service/rbc/rbnawsa/n2748/001.gif
LoC,09002744/,Woman's rights,,"Todd, John 1800-1873|Stone, Lucy 1818-1893|National American Woman Suffrage Association Collection (Library of Congress)","In this pamphlet, clergyman John Todd argues that women are not equal to men because they cannot invent or reason extensively. A good examination of the separate spheres ideology.",1867,,Women's rights,,United States,,,,text,mau|Boston,Lee and Shepard,print,27 p. ; 18 cm.,"statement of responsibility: by Rev. John Todd, D.D. ...|additional physical form: Also available in digital form on the Library of Congress Web site.",https://www.loc.gov/item/09002744/,http://cdn.loc.gov/service/rbc/rbnawsa/n2744/001.gif
LoC,04037023/,The new womanhood,,"Cooley, Winnifred Harper.|Catt, Carrie Chapman 1859-1947|National American Woman Suffrage Association Collection (Library of Congress)","Winnifred Harper Cooley was the daughter of Ida Husted Harper, one of the authors of the multi-volume ""History of Woman Suffrage."" This book, written during the period of time when Anna Howard Shaw was president of NAWSA, includes some interesting chapters on the potential power of women's clubs and on the argument for woman suffrage.",1904,,Women|Social and moral questions,,,,,,text,nyu|New York,Broadway Publishing Company,print,"3 p.l., 151 p. : front. (port.) ; 20 cm.",statement of responsibility: by Winnifred Harper Cooley.|additional physical form: Also available in digital form on the Library of Congress Web site.,https://www.loc.gov/item/04037023/,http://cdn.loc.gov/service/rbc/rbnawsa/n7023/001.gif
LoC,tmp82091485/,"Proceedings at the presentation to the Hon. Robert Dale Owen of a silver pitcher, on behalf of the women of Indiana, on the 28th day of May, 1851",,"Stone, Lucy 1818-1893|Catt, Carrie Chapman 1859-1947|National American Woman Suffrage Association Collection (Library of Congress)","In 1851, Indiana adopted a state constitution that included a measure protecting the property rights of married women. Robert Dale Owen was the chief architect of this provision and the women of Indiana honored him with a silver pitcher. This pamphlet details the ceremony surrounding this presentation, including speeches by Professor W.C. Larrabee of Indian Asbury University and Robert Dale Owen. What is interesting here is the very narrow way in which the women define their role in society and their prosition vis-a-vis women's rights.",1851,biography,"Women|Legal status, laws, etc","Owen, Robert Dale 1801-1877",,,,,text,"inu|New Albany, Ind","Kent & Norman, Printers",print,28 p. ; 23 cm.,additional physical form: Also available in digital form on the Library of Congress Web site.,https://www.loc.gov/item/tmp82091485/,http://cdn.loc.gov/service/rbc/rbnawsa/n1485/001.gif
LoC,09008216/,"""And the truth shall make you free"": a speech on the principles of social freedom, delivered in Steinway Hall, Nov. 20, 1871",Speech on the principles of social freedom,"Woodhull, Victoria C. (Victoria Claflin) 1838-1927|Stone, Lucy 1818-1893|National American Woman Suffrage Association Collection (Library of Congress)","This speech defends Woodhull's advocacy of free love or social freedom, which served to create divisions within the women's rights movement and led eventually to her ostracism by some women's rights associations.",1871,,Free love,,,,,,text,nyu|New York,"Woodhull, Claflin & Co.",print,43 p. ; 25 cm.,"statement of responsibility: by Victoria C. Woodhull, to an audience of 3.000 people, to which hundreds found it impossible to obtain admission; which, in consideration of the dreuching rain of the evening, is the best evidence of what subject lies nearest the hearts of the people.|additional physical form: Also available in digital form on the Library of Congress Web site.",https://www.loc.gov/item/09008216/,http://cdn.loc.gov/service/rbc/rbnawsa/n8216/001.gif
LoC,10001898/,"The Whole World's Temperance Convention, held at Metropolitan Hall in the city of New York, on Thursday and Friday, Sept. 1st and 2d, 1853",,"Whole World's Temperance Convention (1853 : New York, N.Y.)|Stone, Lucy 1818-1893|National American Woman Suffrage Association Collection (Library of Congress)","This conference included the expulsion of female delegates, among them Susan B. Anthony, Lucy Stone, and Abby Foster.",1853,conference publication,Temperance,,,,,,text,nyu|New York,"Fowlers and Wells, Publishers",print,"2 p.l., 111 p. ; 23 cm.","general: ""Compiled from the reports of the Tribune, Times, and Herald; principally from the Tribune.""--t.p. verso.|additional physical form: Also available in digital form on the Library of Congress Web site.",https://www.loc.gov/item/10001898/,http://cdn.loc.gov/service/rbc/rbnawsa/n1898/001.gif
